{
  "authority": {
    "ai_caused_chloe_moffat_death_claims_allowed": false,
    "canonical_product_effects_allowed": false,
    "control_adoption_allowed": false,
    "employer_liability_findings_allowed": false,
    "employer_specific_causation_findings_allowed": false,
    "final_coroner_conclusion_claims_allowed": false,
    "graph_effects_allowed": false,
    "individual_culpability_findings_allowed": false,
    "legal_conclusions_allowed": false,
    "named_company_intent_beyond_public_record_allowed": false,
    "parent_wave_mutation_allowed": false,
    "private_source_publication_allowed": false,
    "publication_effects_allowed": false,
    "universal_prevalence_findings_allowed": false,
    "victim_character_inferences_allowed": false
  },
  "case_id": "AMIN-ABDULLAH-2016",
  "domain": "employment_disciplinary_dismissal_and_independent_review",
  "findings": [
    {
      "finding_id": "HRDS-02-F01",
      "limits": [
        "Independent-report findings are retained within their terms of reference.",
        "No individual legal liability is assigned."
      ],
      "source_ids": [
        "amin-verita-report",
        "amin-itv-report",
        "amin-imperial-learning",
        "nhs-being-fair",
        "nhs-just-learning-case",
        "last-resort-study"
      ],
      "statement": "The public record makes 3 present and 2 absent process states addressable; remaining joins are partial, blocked or not applicable.",
      "status": "public_record_bounded"
    },
    {
      "finding_id": "HRDS-02-F02",
      "limits": [
        "This is a governance synthesis, not a legal category or case-causation finding."
      ],
      "source_ids": [
        "amin-verita-report",
        "amin-itv-report",
        "amin-imperial-learning",
        "nhs-being-fair",
        "nhs-just-learning-case",
        "last-resort-study"
      ],
      "statement": "Severity, welfare and support must be tracked independently from the formal label attached to the process.",
      "status": "bounded_synthesis"
    },
    {
      "finding_id": "HRDS-02-F03",
      "limits": [
        "The synthesis does not imply coordinated intent."
      ],
      "source_ids": [
        "amin-verita-report",
        "amin-itv-report",
        "amin-imperial-learning",
        "nhs-being-fair",
        "nhs-just-learning-case",
        "last-resort-study"
      ],
      "statement": "Fragmented institutional action can create one combined exertion for the person while leaving authorship and correction distributed.",
      "status": "bounded_synthesis"
    },
    {
      "finding_id": "HRDS-02-F04",
      "limits": [
        "Independent-report findings are retained within their terms of reference.",
        "No individual legal liability is assigned."
      ],
      "source_ids": [
        "amin-verita-report",
        "amin-itv-report",
        "amin-imperial-learning",
        "nhs-being-fair",
        "nhs-just-learning-case",
        "last-resort-study"
      ],
      "statement": "unfair process findings and reported redesign recovered complete worker repair and independent implementation verification open.",
      "status": "remains_open"
    }
  ],
  "lane_id": "HRDS-02",
  "name": "Amin Abdullah",
  "observations": [
    {
      "limits": [
        "Independent-report findings are retained within their terms of reference.",
        "No individual legal liability is assigned."
      ],
      "observation_id": "HRDS-02-O01",
      "source_ids": [
        "amin-imperial-learning",
        "amin-itv-report",
        "amin-verita-report",
        "last-resort-study",
        "nhs-being-fair",
        "nhs-just-learning-case"
      ],
      "statement": "The independent report reconstructs the letter, petition and disciplinary trigger. A long delay and dismissal exposure are recovered; complete prospective risk communication is not."
    },
    {
      "limits": [
        "Independent-report findings are retained within their terms of reference.",
        "No individual legal liability is assigned."
      ],
      "observation_id": "HRDS-02-O02",
      "source_ids": [
        "amin-imperial-learning",
        "amin-itv-report",
        "amin-verita-report",
        "last-resort-study",
        "nhs-being-fair",
        "nhs-just-learning-case"
      ],
      "statement": "A disciplinary hearing occurred, but the packet does not recover a complete preparation receipt. The independent report found critical exculpatory evidence was not disclosed."
    },
    {
      "limits": [
        "Independent-report findings are retained within their terms of reference.",
        "No individual legal liability is assigned."
      ],
      "observation_id": "HRDS-02-O03",
      "source_ids": [
        "amin-imperial-learning",
        "amin-itv-report",
        "amin-verita-report",
        "last-resort-study",
        "nhs-being-fair",
        "nhs-just-learning-case"
      ],
      "statement": "Companion and representation custody is not sufficiently recovered. Delay and process measures are public, but complete interim-measure authorship is not."
    },
    {
      "limits": [
        "Independent-report findings are retained within their terms of reference.",
        "No individual legal liability is assigned."
      ],
      "observation_id": "HRDS-02-O04",
      "source_ids": [
        "amin-imperial-learning",
        "amin-itv-report",
        "amin-verita-report",
        "last-resort-study",
        "nhs-being-fair",
        "nhs-just-learning-case"
      ],
      "statement": "No employer-independent welfare owner is recovered through the disciplinary transaction. Deterioration was known across the period, but the employer escalation chain remains incomplete."
    },
    {
      "limits": [
        "Independent-report findings are retained within their terms of reference.",
        "No individual legal liability is assigned."
      ],
      "observation_id": "HRDS-02-O05",
      "source_ids": [
        "amin-imperial-learning",
        "amin-itv-report",
        "amin-verita-report",
        "last-resort-study",
        "nhs-being-fair",
        "nhs-just-learning-case"
      ],
      "statement": "No complete employer safety handoff tied to the dismissal transaction is recovered. The independent report reconstructs investigators, hearing, HR response and conflicting evidence."
    },
    {
      "limits": [
        "Independent-report findings are retained within their terms of reference.",
        "No individual legal liability is assigned."
      ],
      "observation_id": "HRDS-02-O06",
      "source_ids": [
        "amin-imperial-learning",
        "amin-itv-report",
        "amin-verita-report",
        "last-resort-study",
        "nhs-being-fair",
        "nhs-just-learning-case"
      ],
      "statement": "An appeal was pending, but it did not deliver correction before death. Independent review and later employer metrics show some learning; complete worker repair and external verification remain open."
    }
  ],
  "schema_version": 1,
  "source_ids": [
    "amin-verita-report",
    "amin-itv-report",
    "amin-imperial-learning",
    "nhs-being-fair",
    "nhs-just-learning-case",
    "last-resort-study"
  ],
  "terminal_receipt": {
    "closed_questions": [],
    "open_questions": [
      "Was practical job, liberty, family, reputation or status risk accurately bounded?",
      "Was advance notice and a realistic preparation window provided?",
      "Could the person obtain an appropriate companion, representative or advocate?",
      "Were restrictions named, proportionate, reviewed and marked non-prejudicial?",
      "Did expressed or visible distress trigger a documented assessment?",
      "Was there a named same-day, overnight or next-day safety handoff?",
      "Did response become verified implementation, recurrence review and population learning?"
    ],
    "status": "unfair_process_findings_and_reported_redesign_recovered_complete_worker_repair_and_independent_implementation_verification_open"
  },
  "wave_id": "CN-HRDS-W08"
}
